{
    "symbol": "c",
    "name": "speed of light in vacuum",
    "value": 299792458.0,
    "unit": "m s^-1",
    "category": "universal",
    "uncertainty": 0.0,
    "year": 2019,
    "source": "CODATA 2018",
    "description": "Exact value by definition since 2019 SI revision",
    "relations": {
        "used_in": [
            "relativity",
            "electrodynamics"
        ]
    }
}